{
  "admissible_evidence_count": 18,
  "blocker_owners": [
    "clinical safety authority",
    "curation lead",
    "data owner",
    "expert review chair",
    "expert reviewer",
    "platform owner",
    "release approver",
    "safety owner",
    "scientific source approver",
    "security owner",
    "validation owner",
    "verification owner"
  ],
  "claim_count": 24,
  "contingency_scenario_count": 14,
  "contradicted_claim_count": 22,
  "definition_of_done_declared_count_in_prose": 14,
  "definition_of_done_enumerated_count": 15,
  "definition_of_done_satisfied_count": 1,
  "demo_preflight_state": "BLOCKED",
  "demo_stopped_at_step_id": "DEMO-02",
  "evidence_item_count": 145,
  "evidence_pack_integrity": true,
  "evidence_pack_integrity_note": "Evidence pack integrity describes this pack, not the programme. A valid pack that honestly records blockers is still a blocked programme.",
  "gate_count": 6,
  "gate_results": {
    "GATE-A": "BLOCKED",
    "GATE-B": "BLOCKED",
    "GATE-C": "BLOCKED",
    "GATE-D": "BLOCKED",
    "GATE-E": "BLOCKED",
    "GATE-F": "BLOCKED"
  },
  "implementation_note": "The evidence pack software is implemented: the registries, the gate matrix, the Definition of Done registry, the demo preflight, the contingency matrix and the pack integrity check all run and produce results. That is a statement about software. Whether the programme has achieved THS 6 is the separate question below, and the answer is no.",
  "implementation_status": "IMPLEMENTED",
  "not_clinical_validation": "Nothing in this document is clinical validation, scientific validation or expert review. It is an inventory of artifacts and an evaluation of gates. A complete, internally consistent evidence pack describing a blocked programme is exactly what this repository should produce today.",
  "note": "Pack integrity and THS 6 achievement are separate fields and are never derived from one another.",
  "override_available": false,
  "passing_gate_count": 0,
  "release_condition_release_validation_permits": false,
  "release_may_proceed": false,
  "signed_signoff_count": 0,
  "signoff_role_count": 9,
  "source_artifact_disagreement_count": 3,
  "supported_claim_count": 0,
  "ths6_achieved": false,
  "ths6_achievement_conditions": {
    "all_definition_of_done_items_satisfied": false,
    "all_gates_pass": false,
    "all_signoff_roles_signed": false,
    "representative_demonstration_executed": false
  },
  "ths6_status_version": "pgx-wp25-ths6-status/1",
  "total_gate_blocker_count": 45,
  "traceability_has_dangling_reference": false,
  "traceability_row_count": 21,
  "unmet_conditions": [
    "gates GATE-A, GATE-B, GATE-C, GATE-D, GATE-E, GATE-F are not PASS",
    "14 of 15 Definition of Done items are not satisfied",
    "the representative demonstration has not been executed (preflight stopped at DEMO-02)",
    "9 of 9 sign-off roles are unsigned"
  ],
  "work_package": "WP-25"
}
